,gene_symbol,ID,n.spot,ENTREZID,GENENAME,logFC,AveExpr,FC_AvsC,P.Value,adj.P.Val,sig1.3_codes,A1,A2,A2_R,A3,C1,C2,C3,C4,BP,CC,MF,KEGGpathway,Name,GeneName,abs_fc
1461,ZFYVE27,A_23_P323924,1,118813.0,zinc finger FYVE-type containing 27,0.5500139,11.78431,1.4641,0.002380598,0.02591886,0,12.00798,12.0891,12.02181,12.10292,11.55706,11.47595,11.46212,11.54324,GO:0016192 vesicle-mediated transport; GO:0031175 neuron projection development; GO:0045773 positive regulation of axon extension; GO:0048011 neurotrophin TRK receptor signaling pathway; GO:0071787 endoplasmic reticulum tubular network assembly; GO:0072659 protein localization to plasma membrane,GO:0005783 endoplasmic reticulum; GO:0030176 integral component of endoplasmic reticulum membrane; GO:0030424 axon; GO:0030425 dendrite; GO:0032584 growth cone membrane; GO:0055038 recycling endosome membrane; GO:0071782 endoplasmic reticulum tubular network,GO:0005515 protein binding; GO:0043621 protein self-association; GO:0046872 metal ion binding,04144 Endocytosis,NM_001002261,ZFYVE27,0.5500139
1397,ZBTB4,A_23_P100654,10,57659.0,zinc finger and BTB domain containing 4,-0.562257,8.45042,-1.476577,0.002491418,0.02701626,0,8.217497,8.198351,8.187429,8.168283,8.68857,8.707717,8.737784,8.718638,"GO:0000122 negative regulation of transcription from RNA polymerase II promoter; GO:0006351 transcription, DNA-templated; GO:0006974 cellular response to DNA damage stimulus; GO:0045892 negative regulation of transcription, DNA-templated",GO:0005634 nucleus; GO:0005694 chromosome,"GO:0000977 RNA polymerase II regulatory region sequence-specific DNA binding; GO:0001227 transcriptional repressor activity, RNA polymerase II transcription regulatory region sequence-specific binding; GO:0005515 protein binding; GO:0008327 methyl-CpG binding; GO:0010428 methyl-CpNpG binding; GO:0019901 protein kinase binding; GO:0042803 protein homodimerization activity; GO:0043565 sequence-specific DNA binding; GO:0046872 metal ion binding",,NM_020899,ZBTB4,0.562257
1383,ZNF260,A_33_P3414122,1,339324.0,zinc finger protein 260,-0.5656478,8.479552,-1.480052,0.002596337,0.02794779,0,8.260782,8.244376,8.197382,8.180976,8.706024,8.72243,8.78583,8.769424,"GO:0006351 transcription, DNA-templated; GO:0006355 regulation of transcription, DNA-templated; GO:0007275 multicellular organism development",GO:0005654 nucleoplasm; GO:0005737 cytoplasm,"GO:0003677 DNA binding; GO:0003700 transcription factor activity, sequence-specific DNA binding; GO:0046872 metal ion binding",,NM_001012756,ZNF260,0.5656478
1233,ZNF750,A_33_P3423420,1,79755.0,zinc finger protein 750,-0.5955816,6.874726,-1.511082,0.00270111,0.02892155,-1,6.593388,6.654156,6.523326,6.584094,7.156974,7.096206,7.166268,7.227036,GO:0006366 transcription from RNA polymerase II promoter; GO:0008544 epidermis development; GO:0030154 cell differentiation; GO:0045944 positive regulation of transcription from RNA polymerase II promoter,GO:0005634 nucleus; GO:0005730 nucleolus; GO:0043231 intracellular membrane-bounded organelle,"GO:0001046 core promoter sequence-specific DNA binding; GO:0001077 transcriptional activator activity, RNA polymerase II core promoter proximal region sequence-specific binding; GO:0046872 metal ion binding",,NM_024702,ZNF750,0.5955816
1287,ZNF468,A_33_P3382412,1,90333.0,zinc finger protein 468,0.5833285,7.499373,1.498302,0.003186645,0.03347737,1,7.840881,7.728828,7.866609,7.754555,7.155739,7.267793,7.242066,7.130012,"GO:0006351 transcription, DNA-templated; GO:0006355 regulation of transcription, DNA-templated",GO:0005634 nucleus,GO:0003677 DNA binding; GO:0046872 metal ion binding,,NM_199132,ZNF468,0.5833285
1363,ZNF317,A_24_P258955,1,57693.0,zinc finger protein 317,0.56942398755176,8.02383188986271,1.48393097597124,0.0033074891331759,0.0345672167454352,0,8.36934022596048,8.30042469563732,8.33937316181084,8.27045763148768,7.69662844883448,7.76554397915764,7.79551104330728,7.72659551298412,"GO:0006351 transcription, DNA-templated; GO:0006355 regulation of transcription, DNA-templated",GO:0005634 nucleus,"GO:0003677 DNA binding; GO:0003700 transcription factor activity, sequence-specific DNA binding; GO:0046872 metal ion binding",,NM_020933,ZNF317,0.56942398755176
1514,ZBTB45,A_23_P164623,1,84878.0,zinc finger and BTB domain containing 45,-0.538890512541341,10.1135050566308,-1.45285478689629,0.0033394997258379,0.0348792193587516,0,9.82433670606648,9.82842816882891,9.87245066435194,9.87654212711436,10.4232172060532,10.4191257432908,10.3710117850053,10.3751032477677,"GO:0006351 transcription, DNA-templated; GO:0006355 regulation of transcription, DNA-templated",GO:0005634 nucleus,GO:0003677 DNA binding; GO:0046872 metal ion binding,,NM_032792,ZBTB45,0.538890512541341
1076,ZNF730,A_33_P3423445,1,100129543.0,zinc finger protein 730,-0.636789,6.589888,-1.554865,0.003804754,0.03910697,0,6.265647,6.447098,6.10194,6.283391,6.896241,6.71479,6.878497,7.059948,"GO:0006351 transcription, DNA-templated; GO:0006355 regulation of transcription, DNA-templated",GO:0005634 nucleus,GO:0000978 RNA polymerase II core promoter proximal region sequence-specific DNA binding; GO:0046872 metal ion binding,,ENST00000327867,ZNF730,0.636789
1313,ZNF573,A_23_P339079,1,126231.0,zinc finger protein 573,-0.577868936352575,7.26213405251526,-1.4926427759181,0.0038822093308843,0.0397766542850047,0,6.92974534460288,6.9912298246632,6.97867444994133,7.04015893000165,7.60095990754783,7.53947542748751,7.49054632214906,7.55203080220938,"GO:0006351 transcription, DNA-templated; GO:0006355 regulation of transcription, DNA-templated",GO:0005634 nucleus,"GO:0003677 DNA binding; GO:0003700 transcription factor activity, sequence-specific DNA binding; GO:0046872 metal ion binding",,NM_152360,ZNF573,0.577868936352575
1406,ZNHIT2,A_33_P3213747,1,741.0,zinc finger HIT-type containing 2,-0.560604892541019,7.78568354066477,-1.47488747784184,0.0040373556030342,0.0411316732135213,0,7.48343149192452,7.49526396069027,7.52548726596467,7.53731973473042,8.08001306492998,8.06818059616423,8.02612482212408,8.03795729088984,GO:0022008 neurogenesis,,GO:0046872 metal ion binding,,NM_014205,ZNHIT2,0.560604892541019
