,gene_symbol,ID,n.spot,ENTREZID,GENENAME,logFC,AveExpr,FC_AvsC,P.Value,adj.P.Val,sig1.3_codes,A1,A2,A2_R,A3,C1,C2,C3,C4,BP,CC,MF,KEGGpathway,Name,GeneName,abs_fc
18,ZFAND2A,A_23_P336992,1,90637.0,zinc finger AN1-type containing 2A,2.67257625970984,9.99239888164759,6.37566691218742,7.839149181812361e-19,1.2674336397154201e-15,1,11.3079112225503,11.2752657062245,11.3093026485603,11.2766571322345,8.60113506112928,8.63378057745514,8.63238915144514,8.59974363511929,GO:0032436 positive regulation of proteasomal ubiquitin-dependent protein catabolic process; GO:0071243 cellular response to arsenic-containing substance,GO:0000502 proteasome complex; GO:0005634 nucleus; GO:0005737 cytoplasm,GO:0008270 zinc ion binding,,NM_182491,ZFAND2A,2.67257625970984
49,ZFHX3,A_33_P3231542,1,463.0,zinc finger homeobox 3,-1.75789498955695,8.21732961868793,-3.38204296944694,3.0836891046108304e-14,9.232793600619969e-12,-1,7.35812428894734,7.32285974349646,7.38139211961499,7.34612757416411,9.08245080680192,9.1177153522528,9.09444752158515,9.05918297613426,"GO:0000122 negative regulation of transcription from RNA polymerase II promoter; GO:0006355 regulation of transcription, DNA-templated; GO:0006366 transcription from RNA polymerase II promoter; GO:0007050 cell cycle arrest; GO:0007420 brain development; GO:0007517 muscle organ development; GO:0032922 circadian regulation of gene expression; GO:0045664 regulation of neuron differentiation; GO:0045893 positive regulation of transcription, DNA-templated; GO:0071559 response to transforming growth factor beta; GO:1904059 regulation of locomotor rhythm",GO:0005634 nucleus; GO:0005634 nucleus; GO:0005654 nucleoplasm; GO:0005667 transcription factor complex; GO:0005730 nucleolus; GO:0005737 cytoplasm; GO:0016604 nuclear body; GO:0043231 intracellular membrane-bounded organelle,"GO:0001046 core promoter sequence-specific DNA binding; GO:0003700 transcription factor activity, sequence-specific DNA binding; GO:0003705 transcription factor activity, RNA polymerase II distal enhancer sequence-specific binding; GO:0005515 protein binding; GO:0008270 zinc ion binding; GO:0019899 enzyme binding",04550 Signaling pathways regulating pluripotency of stem cells,NM_006885,ZFHX3,1.75789498955695
72,ZMYND8,A_33_P3619221,1,23613.0,zinc finger MYND-type containing 8,-1.587047,9.940464,-3.004337,8.050134e-14,2.133681e-11,-1,9.214569,9.149532,9.215825,9.150787,10.72048,10.78552,10.78426,10.71923,"GO:0000122 negative regulation of transcription from RNA polymerase II promoter; GO:0006355 regulation of transcription, DNA-templated; GO:0051491 positive regulation of filopodium assembly; GO:0060999 positive regulation of dendritic spine development; GO:0098815 modulation of excitatory postsynaptic potential; GO:1902897 regulation of postsynaptic density protein 95 clustering; GO:1902952 positive regulation of dendritic spine maintenance",GO:0005634 nucleus; GO:0005634 nucleus; GO:0005737 cytoplasm; GO:0043197 dendritic spine; GO:0043198 dendritic shaft,GO:0000977 RNA polymerase II regulatory region sequence-specific DNA binding; GO:0001106 RNA polymerase II transcription corepressor activity; GO:0003682 chromatin binding; GO:0003712 transcription cofactor activity; GO:0005515 protein binding; GO:0008270 zinc ion binding; GO:0042393 histone binding; GO:0047485 protein N-terminus binding; GO:0070491 repressing transcription factor binding,,NM_183047,ZMYND8,1.587047
159,ZMIZ1,A_23_P138435,1,57178.0,zinc finger MIZ-type containing 1,-1.32424877944926,9.97661773253961,-2.50402467603335,3.14720661232632e-12,3.74147327265382e-10,-1,9.33446275606019,9.28539275039322,9.39208576897548,9.34301576330852,10.6625968242563,10.7116668299232,10.6540438170079,10.604973811341,"GO:0001570 vasculogenesis; GO:0001701 in utero embryonic development; GO:0003007 heart morphogenesis; GO:0006351 transcription, DNA-templated; GO:0007296 vitellogenesis; GO:0007569 cell aging; GO:0045944 positive regulation of transcription from RNA polymerase II promoter; GO:0048146 positive regulation of fibroblast proliferation; GO:0048589 developmental growth; GO:0048844 artery morphogenesis",GO:0005654 nucleoplasm; GO:0005737 cytoplasm; GO:0016607 nuclear speck; GO:0043231 intracellular membrane-bounded organelle,GO:0008270 zinc ion binding,,NM_020338,ZMIZ1,1.32424877944926
151,ZFAND5,A_24_P290354,1,7763.0,zinc finger AN1-type containing 5,1.3386441747292,10.0136897043317,2.52913522367797,4.28421117207995e-12,4.63445206417429e-10,1,10.5946535168975,10.6733643601902,10.6274016913047,10.7061125345973,9.3849364869825,9.30622564368984,9.27347746928265,9.35218831257531,GO:0001701 in utero embryonic development; GO:0001944 vasculature development; GO:0003016 respiratory system process; GO:0008150 biological_process; GO:0010761 fibroblast migration; GO:0048008 platelet-derived growth factor receptor signaling pathway; GO:0048705 skeletal system morphogenesis; GO:0048745 smooth muscle tissue development; GO:0060324 face development,GO:0005575 cellular_component; GO:0005737 cytoplasm,GO:0003674 molecular_function; GO:0003677 DNA binding; GO:0008270 zinc ion binding,,NM_006007,ZFAND5,1.3386441747292
205,ZNRF3,A_24_P162373,1,84133.0,zinc and ring finger 3,-1.238011,9.389469,-2.358731,5.258609e-11,3.778719e-09,-1,8.796739,8.902701,8.724691,8.830653,10.03147,9.925512,9.997561,10.10352,"GO:0006511 ubiquitin-dependent protein catabolic process; GO:0016567 protein ubiquitination; GO:0016567 protein ubiquitination; GO:0038018 Wnt receptor catabolic process; GO:0038018 Wnt receptor catabolic process; GO:0060070 canonical Wnt signaling pathway; GO:0060071 Wnt signaling pathway, planar cell polarity pathway; GO:0072089 stem cell proliferation; GO:0090090 negative regulation of canonical Wnt signaling pathway; GO:2000051 negative regulation of non-canonical Wnt signaling pathway",GO:0005886 plasma membrane; GO:0005887 integral component of plasma membrane,GO:0004842 ubiquitin-protein transferase activity; GO:0005109 frizzled binding; GO:0005515 protein binding; GO:0008270 zinc ion binding; GO:0016874 ligase activity; GO:0061630 ubiquitin protein ligase activity,,NM_001206998,ZNRF3,1.238011
177,IKZF2,A_32_P114284,1,22807.0,IKAROS family zinc finger 2,-1.28448241345997,6.8491362117993,-2.43594644152584,2.37498414297216e-10,1.41171851557257e-08,-1,6.14851349219961,6.2065765118963,6.22675717310598,6.28482019280268,7.56523010407993,7.50716708438324,7.42892340347686,7.48698642317356,"GO:0006351 transcription, DNA-templated; GO:0008150 biological_process; GO:0045944 positive regulation of transcription from RNA polymerase II promoter",GO:0005634 nucleus,"GO:0003674 molecular_function; GO:0003700 transcription factor activity, sequence-specific DNA binding; GO:0042803 protein homodimerization activity; GO:0044212 transcription regulatory region DNA binding; GO:0046872 metal ion binding; GO:0046982 protein heterodimerization activity",,NM_001079526,IKZF2,1.28448241345997
207,ZBTB21,A_33_P3384775,1,49854.0,zinc finger and BTB domain containing 21,1.22681880694195,6.44444727427954,2.34050331258628,8.12932677011424e-10,4.25355842133356e-08,1,7.10833259202674,7.0226934818069,7.0978176767093,7.01217856648946,5.75705002802687,5.84268913824671,5.85320405356415,5.76756494334432,"GO:0006351 transcription, DNA-templated; GO:0006355 regulation of transcription, DNA-templated",GO:0005634 nucleus,GO:0008327 methyl-CpG binding; GO:0046872 metal ion binding,,ENST00000398497,ZNF295,1.22681880694195
344,HELZ,A_33_P3257973,1,9931.0,helicase with zinc finger,-1.017272,8.65205,-2.024088,1.787569e-09,8.475489e-08,-1,8.186965,8.175246,8.146083,8.134364,9.138665,9.150384,9.191266,9.179547,,GO:0005634 nucleus; GO:0016020 membrane,GO:0004386 helicase activity; GO:0005524 ATP binding; GO:0044822 poly(A) RNA binding; GO:0046872 metal ion binding,,NM_014877,HELZ,1.017272
240,GLI3,A_33_P3290562,1,2737.0,GLI family zinc finger 3,-1.16850748956999,7.32424525751251,-2.24779036090713,2.08582589440348e-09,9.74671475743222e-08,-1,6.80592000172439,6.68924957198159,6.83046379876179,6.71379336901899,7.85497381630121,7.97164424604401,7.94710044900661,7.83043001926381,"GO:0000122 negative regulation of transcription from RNA polymerase II promoter; GO:0001656 metanephros development; GO:0001658 branching involved in ureteric bud morphogenesis; GO:0001701 in utero embryonic development; GO:0002052 positive regulation of neuroblast proliferation; GO:0006366 transcription from RNA polymerase II promoter; GO:0007224 smoothened signaling pathway; GO:0007411 axon guidance; GO:0007442 hindgut morphogenesis; GO:0007507 heart development; GO:0008285 negative regulation of cell proliferation; GO:0009952 anterior/posterior pattern specification; GO:0009954 proximal/distal pattern formation; GO:0016485 protein processing; GO:0021631 optic nerve morphogenesis; GO:0021766 hippocampus development; GO:0021775 smoothened signaling pathway involved in ventral spinal cord interneuron specification; GO:0021776 smoothened signaling pathway involved in spinal cord motor neuron cell fate specification; GO:0021798 forebrain dorsal/ventral pattern formation; GO:0021819 layer formation in cerebral cortex; GO:0021861 forebrain radial glial cell differentiation; GO:0022018 lateral ganglionic eminence cell proliferation; GO:0030318 melanocyte differentiation; GO:0030324 lung development; GO:0032332 positive regulation of chondrocyte differentiation; GO:0033077 T cell differentiation in thymus; GO:0035108 limb morphogenesis; GO:0042060 wound healing; GO:0042307 positive regulation of protein import into nucleus; GO:0042475 odontogenesis of dentin-containing tooth; GO:0042733 embryonic digit morphogenesis; GO:0043066 negative regulation of apoptotic process; GO:0043585 nose morphogenesis; GO:0043586 tongue development; GO:0043627 response to estrogen; GO:0045060 negative thymic T cell selection; GO:0045665 negative regulation of neuron differentiation; GO:0045669 positive regulation of osteoblast differentiation; GO:0045879 negative regulation of smoothened signaling pathway; GO:0045892 negative regulation of transcription, DNA-templated; GO:0045893 positive regulation of transcription, DNA-templated; GO:0045944 positive regulation of transcription from RNA polymerase II promoter; GO:0045944 positive regulation of transcription from RNA polymerase II promoter; GO:0046638 positive regulation of alpha-beta T cell differentiation; GO:0046639 negative regulation of alpha-beta T cell differentiation; GO:0048557 embryonic digestive tract morphogenesis; GO:0048566 embryonic digestive tract development; GO:0048589 developmental growth; GO:0048593 camera-type eye morphogenesis; GO:0048704 embryonic skeletal system morphogenesis; GO:0048709 oligodendrocyte differentiation; GO:0060021 palate development; GO:0060364 frontal suture morphogenesis; GO:0060366 lambdoid suture morphogenesis; GO:0060367 sagittal suture morphogenesis; GO:0060594 mammary gland specification; GO:0060831 smoothened signaling pathway involved in dorsal/ventral neural tube patterning; GO:0060840 artery development; GO:0060873 anterior semicircular canal development; GO:0060875 lateral semicircular canal development; GO:0061005 cell differentiation involved in kidney development; GO:0070242 thymocyte apoptotic process; GO:0090090 negative regulation of canonical Wnt signaling pathway; GO:1903010 regulation of bone development",GO:0005634 nucleus; GO:0005654 nucleoplasm; GO:0005737 cytoplasm; GO:0005829 cytosol; GO:0005829 cytosol; GO:0005929 cilium; GO:0005930 axoneme; GO:0016592 mediator complex; GO:0016607 nuclear speck; GO:0017053 transcriptional repressor complex; GO:0072372 primary cilium; GO:0097542 ciliary tip; GO:0097546 ciliary base,"GO:0000977 RNA polymerase II regulatory region sequence-specific DNA binding; GO:0000978 RNA polymerase II core promoter proximal region sequence-specific DNA binding; GO:0001077 transcriptional activator activity, RNA polymerase II core promoter proximal region sequence-specific binding; GO:0003682 chromatin binding; GO:0003700 transcription factor activity, sequence-specific DNA binding; GO:0005515 protein binding; GO:0008013 beta-catenin binding; GO:0035035 histone acetyltransferase binding; GO:0042826 histone deacetylase binding; GO:0046872 metal ion binding",04024 cAMP signaling pathway; 04340 Hedgehog signaling pathway; 05200 Pathways in cancer; 05217 Basal cell carcinoma,NM_000168,GLI3,1.16850748956999
352,ZNF394,A_33_P3290085,1,84124.0,zinc finger protein 394,1.003775,9.284005,2.00524,2.564293e-09,1.167873e-07,1,9.81058,9.726799,9.822819,9.739038,8.719903,8.803684,8.791445,8.707664,"GO:0006351 transcription, DNA-templated; GO:0006355 regulation of transcription, DNA-templated",GO:0005634 nucleus; GO:0005634 nucleus; GO:0005654 nucleoplasm; GO:0005737 cytoplasm,"GO:0003700 transcription factor activity, sequence-specific DNA binding; GO:0043565 sequence-specific DNA binding; GO:0046872 metal ion binding",,NM_032164,ZNF394,1.003775
351,ZNF473,A_24_P941376,1,25888.0,zinc finger protein 473,1.00486027523175,7.08635483620126,2.00674913429632,1.6061167274954e-08,6.02498729701755e-07,1,7.60740744153507,7.57525576805641,7.59720167384345,7.5650500003648,6.52862838009503,6.56078005357368,6.57098582126529,6.53883414778664,"GO:0006355 regulation of transcription, DNA-templated; GO:0006369 termination of RNA polymerase II transcription; GO:0006398 mRNA 3'-end processing by stem-loop binding and cleavage; GO:0008334 histone mRNA metabolic process",GO:0005654 nucleoplasm; GO:0005654 nucleoplasm; GO:0015030 Cajal body,GO:0003677 DNA binding; GO:0005515 protein binding; GO:0046872 metal ion binding,,NM_015428,ZNF473,1.00486027523175
431,ZNF652,A_23_P55256,1,22834.0,zinc finger protein 652,-0.933862214991123,9.4069612174136,-1.91038341232942,1.65196954696271e-08,6.16837035457114e-07,-1,8.97833218510291,8.91013269207153,9.03494086975551,8.96674137672413,9.8788517436867,9.94705123671808,9.89044255206548,9.8222430590341,"GO:0006351 transcription, DNA-templated; GO:0006355 regulation of transcription, DNA-templated",GO:0005634 nucleus,GO:0003677 DNA binding; GO:0046872 metal ion binding,,NM_014897,ZNF652,0.933862214991123
461,ZNF837,A_33_P3411427,1,116412.0,zinc finger protein 837,-0.9080567,9.741871,-1.876516,1.963299e-08,7.197872e-07,-1,9.336485,9.363242,9.25947,9.286227,10.19727,10.17052,10.24753,10.27429,"GO:0006351 transcription, DNA-templated; GO:0006355 regulation of transcription, DNA-templated",GO:0005634 nucleus,"GO:0000977 RNA polymerase II regulatory region sequence-specific DNA binding; GO:0003700 transcription factor activity, sequence-specific DNA binding; GO:0046872 metal ion binding",,NM_001129730,ZNF837,0.9080567
372,ZNF256,A_23_P16022,1,10172.0,zinc finger protein 256,0.9749751,7.472702,1.965607,2.93992e-08,1.02441e-06,1,7.992,8.019861,7.92377,7.951631,6.958727,6.930866,6.999095,7.026957,"GO:0006351 transcription, DNA-templated; GO:0007275 multicellular organism development; GO:0045892 negative regulation of transcription, DNA-templated",GO:0005634 nucleus,"GO:0000977 RNA polymerase II regulatory region sequence-specific DNA binding; GO:0003700 transcription factor activity, sequence-specific DNA binding; GO:0005515 protein binding; GO:0046872 metal ion binding",,NM_005773,ZNF256,0.9749751
478,UNKL,A_23_P100141,10,64718.0,unkempt family like zinc finger,0.8949636,9.123033,1.859563,3.200085e-08,1.103176e-06,1,9.596757,9.595541,9.532826,9.531611,8.620068,8.621284,8.685214,8.683998,GO:0000209 protein polyubiquitination,GO:0005634 nucleus; GO:0005829 cytosol,GO:0004842 ubiquitin-protein transferase activity; GO:0004842 ubiquitin-protein transferase activity; GO:0008270 zinc ion binding; GO:0016874 ligase activity,,NM_023076,UNKL,0.8949636
403,ZNF438,A_23_P161156,1,220929.0,zinc finger protein 438,-0.9564358,7.440082,-1.94051,4.28973e-08,1.427085e-06,-1,7.022397,6.983366,6.968262,6.92923,7.862343,7.901374,7.95551,7.916478,"GO:0006351 transcription, DNA-templated; GO:0006355 regulation of transcription, DNA-templated",GO:0005634 nucleus; GO:0005654 nucleoplasm; GO:0005737 cytoplasm,GO:0003677 DNA binding; GO:0046872 metal ion binding,,NM_182755,ZNF438,0.9564358
378,ZNF761,A_24_P941487,1,388561.0,zinc finger protein 761,0.971822254567123,7.52196259201769,1.96131635156999,4.66123876686313e-08,1.52556494701707e-06,1,7.94967563670397,7.98982649278137,8.03760481772822,8.07775567380562,7.08762723938017,7.04747638330277,6.95954720227851,6.99969805835591,"GO:0006351 transcription, DNA-templated; GO:0006355 regulation of transcription, DNA-templated",GO:0005634 nucleus,"GO:0003677 DNA binding; GO:0003700 transcription factor activity, sequence-specific DNA binding; GO:0046872 metal ion binding",,NM_001008401,ZNF761,0.971822254567123
549,ZC3H4,A_24_P220618,1,23211.0,zinc finger CCCH-type containing 4,-0.8547091,9.628896,-1.808394,6.780095e-08,2.121839e-06,-1,9.257535,9.216312,9.22577,9.184548,10.04149,10.08271,10.11448,10.07325,,,GO:0044822 poly(A) RNA binding; GO:0046872 metal ion binding,,NM_015168,ZC3H4,0.8547091
602,ZNF281,A_23_P311087,1,23528.0,zinc finger protein 281,0.8227246,8.784432,1.768743,2.968784e-07,7.927168e-06,1,9.176551,9.220583,9.199715,9.243747,8.376372,8.33234,8.309176,8.353208,"GO:0000122 negative regulation of transcription from RNA polymerase II promoter; GO:0006351 transcription, DNA-templated; GO:0010172 embryonic body morphogenesis; GO:0010629 negative regulation of gene expression; GO:0010629 negative regulation of gene expression; GO:0045892 negative regulation of transcription, DNA-templated; GO:0045892 negative regulation of transcription, DNA-templated; GO:0045893 positive regulation of transcription, DNA-templated; GO:0048863 stem cell differentiation",GO:0005634 nucleus; GO:0005654 nucleoplasm,"GO:0000978 RNA polymerase II core promoter proximal region sequence-specific DNA binding; GO:0001047 core promoter binding; GO:0001078 transcriptional repressor activity, RNA polymerase II core promoter proximal region sequence-specific binding; GO:0003700 transcription factor activity, sequence-specific DNA binding; GO:0003714 transcription corepressor activity; GO:0005515 protein binding; GO:0043565 sequence-specific DNA binding; GO:0044212 transcription regulatory region DNA binding; GO:0046872 metal ion binding",,NM_012482,ZNF281,0.8227246
427,ZNF550,A_23_P354827,1,162972.0,zinc finger protein 550,0.9370539,7.496343,1.914614,3.300474e-07,8.676758e-06,1,8.073157,7.956378,7.993988,7.877209,6.908699,7.025477,7.104646,6.987867,"GO:0006351 transcription, DNA-templated; GO:0006355 regulation of transcription, DNA-templated",GO:0005634 nucleus,GO:0003677 DNA binding; GO:0046872 metal ion binding,,ENST00000447310,,0.9370539
629,BAZ1A,A_23_P76799,10,11177.0,bromodomain adjacent to zinc finger domain 1A,-0.8097147,9.180659,-1.752865,3.774891e-07,9.749158e-06,-1,8.838565,8.796787,8.795591,8.753812,9.555108,9.596887,9.639861,9.598083,"GO:0006261 DNA-dependent DNA replication; GO:0006338 chromatin remodeling; GO:0006351 transcription, DNA-templated; GO:0006355 regulation of transcription, DNA-templated",GO:0008623 CHRAC; GO:0016590 ACF complex,GO:0005515 protein binding; GO:0008270 zinc ion binding,,NM_013448,BAZ1A,0.8097147
384,ZBTB42,A_33_P3289128,1,100128927.0,zinc finger and BTB domain containing 42,-0.968877644460515,9.21488376326007,-1.95731729289828,4.25314734820337e-07,1.08461965813489e-05,-1,8.63132472960966,8.66980791366051,8.8536453041541,8.89212848820495,9.83710763163923,9.79862444758838,9.57630387304394,9.61478705709479,"GO:0000122 negative regulation of transcription from RNA polymerase II promoter; GO:0006351 transcription, DNA-templated; GO:0007517 muscle organ development",GO:0005634 nucleus; GO:0005654 nucleoplasm; GO:0005737 cytoplasm; GO:0005886 plasma membrane,GO:0003677 DNA binding; GO:0046872 metal ion binding,,NM_001137601,ZBTB42,0.968877644460515
572,ZFP1,A_23_P3856,1,162239.0,ZFP1 zinc finger protein,-0.8386292,7.5812,-1.78835,5.284512e-07,1.310429e-05,-1,7.150721,7.171896,7.174226,7.195401,8.010147,7.988972,7.965467,7.986642,"GO:0006351 transcription, DNA-templated; GO:0006355 regulation of transcription, DNA-templated",GO:0005634 nucleus,"GO:0003677 DNA binding; GO:0003700 transcription factor activity, sequence-specific DNA binding; GO:0046872 metal ion binding",,NM_153688,ZFP1,0.8386292
580,CASZ1,A_33_P3338300,1,54897.0,castor zinc finger 1,-0.8345146,8.046184,-1.783257,5.584056e-07,1.367925e-05,-1,7.68559,7.63142,7.646947,7.592777,8.404859,8.459029,8.497673,8.443503,"GO:0006351 transcription, DNA-templated; GO:0006355 regulation of transcription, DNA-templated; GO:0007417 central nervous system development; GO:0045664 regulation of neuron differentiation",GO:0005634 nucleus; GO:0005654 nucleoplasm; GO:0005737 cytoplasm; GO:0043231 intracellular membrane-bounded organelle,GO:0003677 DNA binding; GO:0046872 metal ion binding,,NM_001079843,CASZ1,0.8345146
623,ZMYM5,A_23_P65208,1,9205.0,zinc finger MYM-type containing 5,0.812027882944021,8.5187336557199,1.75567752684267,7.09338025991421e-07,1.68655547121019e-05,1,8.95579154611486,8.86855449074438,8.99673206684678,8.9094950114763,8.07229006490546,8.15952712027594,8.11858659954402,8.03134954417354,"GO:0006351 transcription, DNA-templated; GO:0006357 regulation of transcription from RNA polymerase II promoter; GO:0007275 multicellular organism development",GO:0005654 nucleoplasm; GO:0005737 cytoplasm,"GO:0000981 RNA polymerase II transcription factor activity, sequence-specific DNA binding; GO:0003677 DNA binding; GO:0005515 protein binding; GO:0008270 zinc ion binding",,NM_001039650,ZMYM5,0.812027882944021
650,ZNF425,A_24_P941166,1,155054.0,zinc finger protein 425,0.7993152424339,7.95571998490077,1.74027493031269,9.72514038340175e-07,2.25266575528423e-05,1,8.3711305386449,8.37609065645012,8.35075377076876,8.35571388857399,7.55475216389789,7.54979204609267,7.57016881396881,7.57512893177403,"GO:0006351 transcription, DNA-templated; GO:0045892 negative regulation of transcription, DNA-templated",GO:0005634 nucleus; GO:0005737 cytoplasm,GO:0003677 DNA binding; GO:0046872 metal ion binding,,NM_001001661,ZNF425,0.7993152424339
532,ZNF100,A_33_P3237403,1,163227.0,zinc finger protein 100,-0.863941072362154,8.03086763947364,-1.82000330765109,1.29604041094993e-06,2.89825468385042e-05,-1,7.71006396674904,7.60517358309425,7.61984433133929,7.51495394768451,8.34801729595785,8.45290767961263,8.54312731502237,8.43823693136759,"GO:0006351 transcription, DNA-templated; GO:0006355 regulation of transcription, DNA-templated",GO:0005634 nucleus,GO:0000978 RNA polymerase II core promoter proximal region sequence-specific DNA binding; GO:0046872 metal ion binding,,NM_173531,ZNF100,0.863941072362154
781,ZNF622,A_23_P156209,1,90441.0,zinc finger protein 622,0.734340615776458,10.4405620800752,1.66363692985027,1.58340412645531e-06,3.48305821993597e-05,1,10.7761946157962,10.7630247645103,10.8381743833543,10.8250045320685,10.0960768248591,10.109246676145,10.0472669085869,10.034097057301,GO:0008631 intrinsic apoptotic signaling pathway in response to oxidative stress; GO:0033674 positive regulation of kinase activity; GO:0042273 ribosomal large subunit biogenesis; GO:0043065 positive regulation of apoptotic process; GO:0043410 positive regulation of MAPK cascade; GO:0046330 positive regulation of JNK cascade,"GO:0005730 nucleolus; GO:0005737 cytoplasm; GO:0005794 Golgi apparatus; GO:0022625 cytosolic large ribosomal subunit; GO:0030687 preribosome, large subunit precursor",GO:0005515 protein binding; GO:0008270 zinc ion binding; GO:0044822 poly(A) RNA binding,,NM_033414,ZNF622,0.734340615776458
501,ZBTB14,A_24_P74064,1,7541.0,zinc finger and BTB domain containing 14,-0.875143883143433,7.00407982200873,-1.83419100518311,2.27433975570839e-06,4.85753304759488e-05,-1,6.63466157144699,6.49260003073443,6.66929305043161,6.52723150971905,7.38887694671437,7.53093848742693,7.49630700844231,7.35424546772975,"GO:0000122 negative regulation of transcription from RNA polymerase II promoter; GO:0003170 heart valve development; GO:0003279 cardiac septum development; GO:0006351 transcription, DNA-templated; GO:0045892 negative regulation of transcription, DNA-templated; GO:0060976 coronary vasculature development",GO:0005634 nucleus; GO:0005654 nucleoplasm; GO:0005737 cytoplasm,"GO:0003700 transcription factor activity, sequence-specific DNA binding; GO:0005515 protein binding; GO:0043565 sequence-specific DNA binding; GO:0044212 transcription regulatory region DNA binding; GO:0046872 metal ion binding",,NM_003409,ZFP161,0.875143883143433
754,ZCCHC8,A_23_P64669,1,55596.0,zinc finger CCHC-type containing 8,0.747105434340346,10.1927846810483,1.67842193134985,2.39146238793063e-06,5.08752156421874e-05,1,10.6121012136827,10.5441929350876,10.5486630432784,10.4807547646832,9.75500666107488,9.82291493967002,9.88635311007435,9.81844483147922,"GO:0000398 mRNA splicing, via spliceosome",GO:0005634 nucleus; GO:0005654 nucleoplasm; GO:0071013 catalytic step 2 spliceosome,GO:0008270 zinc ion binding; GO:0044822 poly(A) RNA binding,,NM_017612,ZCCHC8,0.747105434340346
719,ZCCHC14,A_23_P100420,10,23174.0,zinc finger CCHC-type containing 14,-0.7663666,8.628199,-1.700981,2.622983e-06,5.529125e-05,-1,8.260431,8.220067,8.317509,8.277145,9.00981,9.050174,8.993097,8.952733,,,GO:0003676 nucleic acid binding; GO:0008270 zinc ion binding; GO:0035091 phosphatidylinositol binding,,NM_015144,ZCCHC14,0.7663666
716,ZDHHC14,A_23_P250619,1,79683.0,zinc finger DHHC-type containing 14,-0.768326430315616,8.66793217471408,-1.70329276616594,2.8595739056893e-06,5.98105962576774e-05,-1,8.36204387975827,8.29345268222268,8.32357227896736,8.25498108143178,8.98391916952717,9.05251036706275,9.09098196785366,9.02239077031808,GO:0018345 protein palmitoylation,GO:0005783 endoplasmic reticulum; GO:0016021 integral component of membrane,GO:0008270 zinc ion binding; GO:0016409 palmitoyltransferase activity; GO:0019706 protein-cysteine S-palmitoyltransferase activity,,NM_153746,ZDHHC14,0.768326430315616
