,gene_symbol,ID,n.spot,ENTREZID,GENENAME,logFC,AveExpr,FC_AvsC,P.Value,adj.P.Val,sig1.3_codes,A1,A2,A2_R,A3,C1,C2,C3,C4,BP,CC,MF,KEGGpathway,Name,GeneName,abs_fc
809,ZC2HC1A,A_23_P20363,1,51101.0,zinc finger C2HC-type containing 1A,-0.7245842,9.408935,-1.652424,4.15595e-06,8.505494e-05,-1,9.11029,9.076992,9.078507,9.045209,9.74543,9.778728,9.810511,9.777213,,,GO:0005515 protein binding; GO:0046872 metal ion binding,,NM_016010,FAM164A,0.7245842
708,ZHX3,A_24_P57700,1,23051.0,zinc fingers and homeoboxes 3,-0.7707166,7.327048,-1.706117,4.684323e-06,9.443409e-05,-1,6.959203,6.961636,6.946002,6.948435,7.706933,7.7045,7.717701,7.720134,"GO:0000122 negative regulation of transcription from RNA polymerase II promoter; GO:0006351 transcription, DNA-templated; GO:0030154 cell differentiation; GO:0045669 positive regulation of osteoblast differentiation; GO:0045892 negative regulation of transcription, DNA-templated",GO:0005634 nucleus; GO:0005654 nucleoplasm,"GO:0003677 DNA binding; GO:0003700 transcription factor activity, sequence-specific DNA binding; GO:0003714 transcription corepressor activity; GO:0005515 protein binding; GO:0042803 protein homodimerization activity; GO:0046872 metal ion binding; GO:0046982 protein heterodimerization activity",,NM_015035,ZHX3,0.7707166
834,ZBTB43,A_33_P3349414,1,23099.0,zinc finger and BTB domain containing 43,0.716849801491742,9.5283565062348,1.6435892521433,9.78390673350514e-06,0.0001850131041722,1,9.83785637202947,9.91272171158563,9.85171905755931,9.92658439711547,9.18401412468337,9.10914878512721,9.09528609959736,9.17015143915353,"GO:0006351 transcription, DNA-templated; GO:0006355 regulation of transcription, DNA-templated",GO:0005634 nucleus,GO:0003677 DNA binding; GO:0005515 protein binding; GO:0046872 metal ion binding,,NM_014007,ZBTB43,0.716849801491742
707,ZNF107,A_23_P45087,1,51427.0,zinc finger protein 107,-0.77125766551874,7.33348638111267,-1.70675699602237,1.38675537800145e-05,0.000252774080626,-1,6.9628578826539,7.05377496996911,6.86702801997429,6.9579451072895,7.71840824974323,7.62749116242802,7.72332102510763,7.81423811242284,"GO:0006351 transcription, DNA-templated; GO:0006355 regulation of transcription, DNA-templated; GO:0008150 biological_process",GO:0005575 cellular_component; GO:0005634 nucleus,GO:0003674 molecular_function; GO:0003677 DNA binding; GO:0046872 metal ion binding,,NM_016220,ZNF107,0.77125766551874
820,ZFP30,A_33_P3362861,1,22835.0,ZFP30 zinc finger protein,-0.720962700351504,7.70879339327208,-1.64828155444332,1.82742973067838e-05,0.0003250372264643,-1,7.33103680606945,7.36243379920034,7.36104958074991,7.39244657388079,8.07411527296083,8.04271827982995,8.01270550514949,8.04410249828037,"GO:0006351 transcription, DNA-templated; GO:0006355 regulation of transcription, DNA-templated",GO:0005634 nucleus,"GO:0003677 DNA binding; GO:0003700 transcription factor activity, sequence-specific DNA binding; GO:0046872 metal ion binding",,NM_014898,ZFP30,0.720962700351504
881,ZNRF1,A_24_P16610,1,84937.0,zinc and ring finger 1,-0.7006822,8.454897,-1.625273,4.867657e-05,0.0007862166,-1,8.146394,8.226576,8.032401,8.112583,8.771708,8.691526,8.805519,8.885701,GO:0000209 protein polyubiquitination; GO:0043161 proteasome-mediated ubiquitin-dependent protein catabolic process; GO:0070936 protein K48-linked ubiquitination,GO:0005764 lysosome; GO:0005768 endosome; GO:0005829 cytosol; GO:0005829 cytosol; GO:0016020 membrane; GO:0030054 cell junction; GO:0030672 synaptic vesicle membrane,GO:0004842 ubiquitin-protein transferase activity; GO:0004842 ubiquitin-protein transferase activity; GO:0004842 ubiquitin-protein transferase activity; GO:0005515 protein binding; GO:0008270 zinc ion binding; GO:0016874 ligase activity; GO:0061630 ubiquitin protein ligase activity,,NM_032268,ZNRF1,0.7006822
973,ZNF765,A_33_P3289422,1,91661.0,zinc finger protein 765,0.6670065,10.33903,1.587775,5.314731e-05,0.0008499365,1,10.69196,10.73407,10.58539,10.6275,9.979802,9.937693,10.04426,10.08637,"GO:0006351 transcription, DNA-templated; GO:0006355 regulation of transcription, DNA-templated",GO:0005634 nucleus,GO:0003677 DNA binding; GO:0046872 metal ion binding,,NM_001040185,ZNF765,0.6670065
923,ZMYND11,A_23_P75083,1,10771.0,zinc finger MYND-type containing 11,-0.6840534,8.549495,-1.606647,6.409976e-05,0.001005204,0,8.24991,8.299373,8.129763,8.179227,8.868682,8.819219,8.939365,8.988829,"GO:0000122 negative regulation of transcription from RNA polymerase II promoter; GO:0006351 transcription, DNA-templated; GO:0007049 cell cycle; GO:0008283 cell proliferation; GO:0016032 viral process; GO:0016569 chromatin modification; GO:0034243 regulation of transcription elongation from RNA polymerase II promoter; GO:0043124 negative regulation of I-kappaB kinase/NF-kappaB signaling; GO:0046329 negative regulation of JNK cascade; GO:2001237 negative regulation of extrinsic apoptotic signaling pathway",GO:0005634 nucleus; GO:0005654 nucleoplasm; GO:0005694 chromosome,GO:0000977 RNA polymerase II regulatory region sequence-specific DNA binding; GO:0003682 chromatin binding; GO:0003712 transcription cofactor activity; GO:0003714 transcription corepressor activity; GO:0005515 protein binding; GO:0008270 zinc ion binding; GO:0035064 methylated histone binding; GO:0042393 histone binding,,NM_212479,ZMYND11,0.6840534
796,ZNF10,A_23_P203829,1,7556.0,zinc finger protein 10,0.7302323,6.627414,1.658906,8.738638e-05,0.001325124,1,6.973287,7.080262,6.918752,7.025727,6.276217,6.169242,6.223778,6.330752,"GO:0006351 transcription, DNA-templated; GO:0006355 regulation of transcription, DNA-templated",GO:0005634 nucleus,GO:0003677 DNA binding; GO:0005515 protein binding; GO:0046872 metal ion binding,,NM_015394,ZNF10,0.7302323
1031,ZNF75A,A_33_P3279109,1,7627.0,zinc finger protein 75a,0.6508195,8.547897,1.57006,9.120458e-05,0.00137684,1,8.897941,8.911811,8.861953,8.875823,8.183991,8.170122,8.20611,8.219979,"GO:0006351 transcription, DNA-templated; GO:0006355 regulation of transcription, DNA-templated; GO:0008150 biological_process",GO:0005634 nucleus,GO:0003674 molecular_function; GO:0003677 DNA binding; GO:0046872 metal ion binding,,BC039601,ZNF75A,0.6508195
848,ZNF44,A_33_P3278774,1,51710.0,zinc finger protein 44,0.710314370835769,6.93394971505686,1.63616060627352,9.51905042422729e-05,0.0014303346399526,1,7.33931575237753,7.33583923877013,7.24445468117262,7.24097816756523,6.51952257652633,6.52299909013373,6.61786016133863,6.61438364773124,"GO:0006351 transcription, DNA-templated; GO:0006355 regulation of transcription, DNA-templated",GO:0005634 nucleus,GO:0003677 DNA binding; GO:0046872 metal ion binding,,ENST00000483826,ZNF44,0.710314370835769
1091,ZNF644,A_23_P200772,1,84146.0,zinc finger protein 644,-0.6342966,9.090327,-1.552181,0.0001364724,0.00198425,0,8.821537,8.835349,8.760724,8.774537,9.379866,9.366053,9.426866,9.440678,"GO:0006351 transcription, DNA-templated; GO:0006355 regulation of transcription, DNA-templated",GO:0005634 nucleus,GO:0003677 DNA binding; GO:0046872 metal ion binding,,NM_201269,ZNF644,0.6342966
952,ZMAT4,A_32_P164593,1,79698.0,zinc finger matrin-type 4,-0.6741891,6.781607,-1.5957,0.0001868996,0.002639121,-1,6.477032,6.483269,6.432377,6.438614,7.105756,7.099519,7.144174,7.150411,GO:0072332 intrinsic apoptotic signaling pathway by p53 class mediator,GO:0005634 nucleus,GO:0002039 p53 binding; GO:0003677 DNA binding; GO:0003723 RNA binding; GO:0008270 zinc ion binding,,NM_024645,ZMAT4,0.6741891
1107,ZNF165,A_23_P93269,1,7718.0,zinc finger protein 165,0.630092598972527,8.94785850418911,1.54766432675092,0.0002142214636804,0.0029781019989561,1,9.30873351688144,9.22849914727014,9.31654458111727,9.23631021150598,8.57593498233675,8.65616935194805,8.64835828771221,8.56812391810092,"GO:0006351 transcription, DNA-templated; GO:0006355 regulation of transcription, DNA-templated",GO:0005634 nucleus,"GO:0003700 transcription factor activity, sequence-specific DNA binding; GO:0043565 sequence-specific DNA binding; GO:0046872 metal ion binding",,NM_003447,ZNF165,0.630092598972527
1082,GLIS2,A_33_P3333224,1,84662.0,GLIS family zinc finger 2,-0.6355867,7.893257,-1.553569,0.0002419078,0.003314956,-1,7.608512,7.607315,7.572974,7.571777,8.16633,8.167527,8.203065,8.201868,"GO:0000122 negative regulation of transcription from RNA polymerase II promoter; GO:0006366 transcription from RNA polymerase II promoter; GO:0007399 nervous system development; GO:0043433 negative regulation of sequence-specific DNA binding transcription factor activity; GO:0045879 negative regulation of smoothened signaling pathway; GO:0045892 negative regulation of transcription, DNA-templated; GO:0045893 positive regulation of transcription, DNA-templated; GO:0045944 positive regulation of transcription from RNA polymerase II promoter; GO:0060994 regulation of transcription from RNA polymerase II promoter involved in kidney development; GO:0061005 cell differentiation involved in kidney development; GO:1900182 positive regulation of protein localization to nucleus",GO:0005634 nucleus; GO:0005737 cytoplasm; GO:0016607 nuclear speck; GO:0031513 nonmotile primary cilium,"GO:0000977 RNA polymerase II regulatory region sequence-specific DNA binding; GO:0001077 transcriptional activator activity, RNA polymerase II core promoter proximal region sequence-specific binding; GO:0005515 protein binding; GO:0044212 transcription regulatory region DNA binding; GO:0046872 metal ion binding",,NM_032575,GLIS2,0.6355867
1062,ZNF330,A_23_P41359,1,27309.0,zinc finger protein 330,0.6400641,8.725659,1.558398,0.0002419376,0.003314956,1,9.002487,9.03159,9.094666,9.123768,8.439348,8.410245,8.318067,8.347169,GO:0008150 biological_process,"GO:0000775 chromosome, centromeric region; GO:0005730 nucleolus; GO:0030496 midbody",GO:0008270 zinc ion binding; GO:0046872 metal ion binding,,NM_014487,ZNF330,0.6400641
1044,ZSWIM6,A_23_P410859,1,57688.0,zinc finger SWIM-type containing 6,-0.645739088794159,7.46475975403175,-1.5645405909287,0.0002543772527088,0.0034677667974672,-1,7.17542347377482,7.14244073158262,7.16635191833766,7.13336917614547,7.76212544190725,7.79510818409945,7.8041797395366,7.77119699734441,GO:0048812 neuron projection morphogenesis; GO:2001222 regulation of neuron migration,,GO:0008270 zinc ion binding,,NM_020928,ZSWIM6,0.645739088794159
1035,GZF1,A_24_P156288,1,64412.0,GDNF inducible zinc finger protein 1,0.649077572799384,7.06210887474003,1.56816522513641,0.0003518713719171,0.0046214917474871,1,7.36103401286573,7.3892236332825,7.38592110180989,7.41411072222665,6.74133517255757,6.71314555214081,6.68825846319665,6.71644808361341,"GO:0000122 negative regulation of transcription from RNA polymerase II promoter; GO:0000122 negative regulation of transcription from RNA polymerase II promoter; GO:0001658 branching involved in ureteric bud morphogenesis; GO:0006351 transcription, DNA-templated; GO:0045892 negative regulation of transcription, DNA-templated",GO:0005634 nucleus; GO:0005654 nucleoplasm; GO:0005730 nucleolus; GO:0005737 cytoplasm; GO:0005794 Golgi apparatus,"GO:0000978 RNA polymerase II core promoter proximal region sequence-specific DNA binding; GO:0000978 RNA polymerase II core promoter proximal region sequence-specific DNA binding; GO:0000980 RNA polymerase II distal enhancer sequence-specific DNA binding; GO:0001078 transcriptional repressor activity, RNA polymerase II core promoter proximal region sequence-specific binding; GO:0001078 transcriptional repressor activity, RNA polymerase II core promoter proximal region sequence-specific binding; GO:0001206 transcriptional repressor activity, RNA polymerase II distal enhancer sequence-specific binding; GO:0001206 transcriptional repressor activity, RNA polymerase II distal enhancer sequence-specific binding; GO:0043565 sequence-specific DNA binding; GO:0046872 metal ion binding",,NM_022482,GZF1,0.649077572799384
997,ZNF462,A_23_P60499,1,58499.0,zinc finger protein 462,-0.659640443945427,6.98268599699855,-1.57968887628332,0.0005589187631528,0.0070875282844355,-1,6.72094593507767,6.59792303321139,6.7340769289878,6.61105402712152,7.26158466730904,7.38460756917532,7.37147657526519,7.24845367339891,"GO:0006325 chromatin organization; GO:0006351 transcription, DNA-templated; GO:0043392 negative regulation of DNA binding; GO:0045944 positive regulation of transcription from RNA polymerase II promoter",GO:0005634 nucleus,GO:0003677 DNA binding; GO:0046872 metal ion binding,,NM_021224,ZNF462,0.659640443945427
1229,ZC3H3,A_33_P3423820,1,23144.0,zinc finger CCCH-type containing 3,-0.5963397,10.45615,-1.511876,0.000560782,0.007100018,-1,10.18692,10.09703,10.20834,10.11845,10.73237,10.82226,10.80085,10.71096,"GO:0006378 mRNA polyadenylation; GO:0010793 regulation of mRNA export from nucleus; GO:0016973 poly(A)+ mRNA export from nucleus; GO:0032927 positive regulation of activin receptor signaling pathway; GO:0090502 RNA phosphodiester bond hydrolysis, endonucleolytic",GO:0005634 nucleus; GO:0005847 mRNA cleavage and polyadenylation specificity factor complex,GO:0003674 molecular_function; GO:0003677 DNA binding; GO:0003723 RNA binding; GO:0004521 endoribonuclease activity; GO:0046872 metal ion binding; GO:0070412 R-SMAD binding,,NM_015117,ZC3H3,0.5963397
1217,ZNF341,A_33_P3220095,1,84905.0,zinc finger protein 341,-0.599855504629017,8.74165516494599,-1.51556476515675,0.0005637073896556,0.0071314718904167,-1,8.48028240711723,8.43969547882053,8.50815135960805,8.46756443131135,9.01886121425675,9.05944814255345,9.03157919006264,8.99099226176594,"GO:0006351 transcription, DNA-templated; GO:0006355 regulation of transcription, DNA-templated",GO:0005634 nucleus,"GO:0003677 DNA binding; GO:0003700 transcription factor activity, sequence-specific DNA binding; GO:0046872 metal ion binding",,NM_032819,ZNF341,0.599855504629017
1238,ZZEF1,A_24_P282108,1,23140.0,zinc finger ZZ-type and EF-hand domain containing 1,-0.5932434,8.940075,-1.508635,0.0006728446,0.008356804,-1,8.694212,8.678827,8.640596,8.625212,9.197451,9.212835,9.26645,9.251066,,,GO:0005509 calcium ion binding; GO:0008270 zinc ion binding,,NM_015113,ZZEF1,0.5932434
1259,ZXDB,A_33_P3334308,1,158586.0,"zinc finger, X-linked, duplicated B",0.588996565208607,8.81680357860712,1.50420017016064,0.0007389339174763,0.0090921488415205,1,9.1110748229668,9.14864003154176,9.08729147829604,9.12485668687101,8.50861745697876,8.47105224840379,8.49483559307455,8.53240080164952,"GO:0006351 transcription, DNA-templated; GO:0006355 regulation of transcription, DNA-templated; GO:0008150 biological_process",GO:0005634 nucleus,GO:0003674 molecular_function; GO:0003676 nucleic acid binding; GO:0046872 metal ion binding,,NM_007157,ZXDB,0.588996565208607
1235,ZNF362,A_23_P137543,1,149076.0,zinc finger protein 362,-0.59453044291642,8.29619992924399,-1.50998104876991,0.0007443961754698,0.0091454387272015,0,8.00512398494185,8.01948599467595,8.00840156151696,8.02276357125106,8.58914674173968,8.57478473200558,8.57150715543047,8.58586916516457,"GO:0006351 transcription, DNA-templated; GO:0006355 regulation of transcription, DNA-templated",GO:0005634 nucleus,GO:0003677 DNA binding; GO:0046872 metal ion binding,,NM_152493,ZNF362,0.59453044291642
1167,BAZ2A,A_23_P203841,1,11176.0,bromodomain adjacent to zinc finger domain 2A,0.6137978,7.405433,1.530282,0.0008424107,0.0102253,1,7.731884,7.747813,7.700677,7.716606,7.037442,7.021513,7.05272,7.068649,"GO:0000183 chromatin silencing at rDNA; GO:0006306 DNA methylation; GO:0006338 chromatin remodeling; GO:0006351 transcription, DNA-templated; GO:0006355 regulation of transcription, DNA-templated; GO:0016575 histone deacetylation",GO:0005654 nucleoplasm; GO:0005677 chromatin silencing complex; GO:0005730 nucleolus; GO:0005737 cytoplasm; GO:0033553 rDNA heterochromatin,GO:0001164 RNA polymerase I CORE element sequence-specific DNA binding; GO:0003723 RNA binding; GO:0005515 protein binding; GO:0008270 zinc ion binding; GO:0016922 ligand-dependent nuclear receptor binding; GO:0042393 histone binding; GO:0070577 lysine-acetylated histone binding,,NM_013449,BAZ2A,0.6137978
1055,ZNF263,A_23_P140978,1,10127.0,zinc finger protein 263,0.642648026592337,6.49391216735464,1.56119205569878,0.0008627050954807,0.0104091164057711,1,6.84541237091227,6.71968117004779,6.92280337865839,6.79707217779392,6.09941436726634,6.22514556813081,6.14775456038469,6.02202335952022,"GO:0006351 transcription, DNA-templated; GO:0006355 regulation of transcription, DNA-templated; GO:0045892 negative regulation of transcription, DNA-templated",GO:0005634 nucleus; GO:0005634 nucleus; GO:0005654 nucleoplasm; GO:0005737 cytoplasm; GO:0015630 microtubule cytoskeleton,"GO:0003700 transcription factor activity, sequence-specific DNA binding; GO:0043565 sequence-specific DNA binding; GO:0046872 metal ion binding",,NM_005741,ZNF263,0.642648026592337
1292,ZNF668,A_33_P3290487,1,79759.0,zinc finger protein 668,-0.5825409,11.01713,-1.497484,0.0009090795,0.01091976,-1,10.64904,10.73049,10.70115,10.7826,11.38904,11.30759,11.25548,11.33692,"GO:0006351 transcription, DNA-templated; GO:0006355 regulation of transcription, DNA-templated",GO:0005634 nucleus,"GO:0003677 DNA binding; GO:0003700 transcription factor activity, sequence-specific DNA binding; GO:0046872 metal ion binding",,NM_001172668,ZNF668,0.5825409
1204,LIMS1,A_23_P210358,1,3987.0,LIM zinc finger domain containing 1,-0.603529720644077,8.78716610868304,-1.51942948296916,0.0009212623259378,0.0110578836568402,0,8.57529162447612,8.51688479591379,8.49778251093075,8.43937568236842,9.01137302837231,9.06977985693464,9.14728897048,9.08888214191767,"GO:0007569 cell aging; GO:0010628 positive regulation of gene expression; GO:0010811 positive regulation of cell-substrate adhesion; GO:0034329 cell junction assembly; GO:0043547 positive regulation of GTPase activity; GO:0045184 establishment of protein localization; GO:0045892 negative regulation of transcription, DNA-templated; GO:0051291 protein heterooligomerization; GO:0051894 positive regulation of focal adhesion assembly; GO:0071560 cellular response to transforming growth factor beta stimulus; GO:1900026 positive regulation of substrate adhesion-dependent cell spreading",GO:0005829 cytosol; GO:0005886 plasma membrane; GO:0005911 cell-cell junction; GO:0005925 focal adhesion; GO:0043234 protein complex; GO:0048471 perinuclear region of cytoplasm,GO:0005515 protein binding; GO:0008270 zinc ion binding; GO:0019901 protein kinase binding,,NM_004987,LIMS1,0.603529720644077
1103,ZNF433,A_23_P27649,1,163059.0,zinc finger protein 433,0.6310144,8.031653,1.548654,0.001009394,0.0119911,1,8.349356,8.464747,8.253975,8.369366,7.721139,7.605748,7.701129,7.81652,"GO:0006351 transcription, DNA-templated; GO:0006355 regulation of transcription, DNA-templated",GO:0005634 nucleus,GO:0003677 DNA binding; GO:0046872 metal ion binding,,NM_001080411,ZNF433,0.6310144
1113,BAZ2B,A_23_P120048,10,29994.0,bromodomain adjacent to zinc finger domain 2B,-0.6292019,6.240728,-1.546709,0.001034806,0.01225756,-1,5.923839,5.945144,5.917018,5.938324,6.566579,6.545273,6.552094,6.573399,"GO:0006351 transcription, DNA-templated; GO:0006355 regulation of transcription, DNA-templated",GO:0005634 nucleus,GO:0003677 DNA binding; GO:0005515 protein binding; GO:0008270 zinc ion binding,,NM_013450,BAZ2B,0.6292019
1248,ZNF638,A_24_P3140,1,27332.0,zinc finger protein 638,-0.5908615,8.373489,-1.506146,0.001139006,0.0133542,0,8.136078,8.122519,8.06329,8.049732,8.62841,8.641969,8.714757,8.701198,"GO:0006351 transcription, DNA-templated; GO:0006355 regulation of transcription, DNA-templated; GO:0008380 RNA splicing",GO:0005654 nucleoplasm; GO:0005737 cytoplasm; GO:0016607 nuclear speck; GO:0043231 intracellular membrane-bounded organelle,GO:0000166 nucleotide binding; GO:0003690 double-stranded DNA binding; GO:0003723 RNA binding; GO:0008270 zinc ion binding; GO:0044822 poly(A) RNA binding,,NM_014497,ZNF638,0.5908615
1144,ZNF117,A_33_P3222744,1,51351.0,zinc finger protein 117,-0.622319929916648,6.50940349485999,-1.53934854596837,0.0014532988174859,0.0166056079725178,-1,6.22882266976446,6.24672206907637,6.15839225648639,6.1762916557983,6.79503472651582,6.7771353272039,6.84756574048197,6.86546513979389,"GO:0006351 transcription, DNA-templated; GO:0006355 regulation of transcription, DNA-templated",GO:0005634 nucleus,"GO:0000978 RNA polymerase II core promoter proximal region sequence-specific DNA binding; GO:0003700 transcription factor activity, sequence-specific DNA binding; GO:0008270 zinc ion binding",,NM_015852,ZNF117,0.622319929916648
1043,ZNF594,A_23_P321160,1,84622.0,zinc finger protein 594,-0.6457499,6.337152,-1.564552,0.001668129,0.0187424,-1,5.927443,6.038814,6.004397,6.115768,6.749605,6.638234,6.561281,6.672651,"GO:0006351 transcription, DNA-templated; GO:0006355 regulation of transcription, DNA-templated",GO:0005634 nucleus,GO:0003677 DNA binding; GO:0046872 metal ion binding,,NM_032530,ZNF594,0.6457499
1126,ZNF91,A_33_P3217230,1,7644.0,zinc finger protein 91,-0.6256833,6.216284,-1.542941,0.001699869,0.01904607,0,5.931913,5.867289,5.985931,5.921308,6.514171,6.578795,6.524777,6.460153,"GO:0006351 transcription, DNA-templated; GO:0045892 negative regulation of transcription, DNA-templated; GO:0070895 negative regulation of transposon integration",GO:0005634 nucleus,"GO:0003677 DNA binding; GO:0003700 transcription factor activity, sequence-specific DNA binding; GO:0003700 transcription factor activity, sequence-specific DNA binding; GO:0008270 zinc ion binding",,NM_003430,ZNF91,0.6256833
1158,PATZ1,A_24_P211558,1,23598.0,POZ/BTB and AT hook containing zinc finger 1,-0.617495001018885,6.79512455957931,-1.53420896960845,0.0018015799821979,0.0201159842211161,-1,6.4260289128963,6.49993662223071,6.49143826488924,6.56534597422365,7.16055118718292,7.0866434778485,7.02123412585556,7.09514183518997,"GO:0006355 regulation of transcription, DNA-templated; GO:0006366 transcription from RNA polymerase II promoter; GO:0007283 spermatogenesis; GO:0008584 male gonad development; GO:0030217 T cell differentiation; GO:0045892 negative regulation of transcription, DNA-templated; GO:0045944 positive regulation of transcription from RNA polymerase II promoter",GO:0005634 nucleus; GO:0005654 nucleoplasm,"GO:0000978 RNA polymerase II core promoter proximal region sequence-specific DNA binding; GO:0001077 transcriptional activator activity, RNA polymerase II core promoter proximal region sequence-specific binding; GO:0003677 DNA binding; GO:0003682 chromatin binding; GO:0046872 metal ion binding",,NM_032051,PATZ1,0.617495001018885
1207,ZBTB24,A_23_P134147,1,9841.0,zinc finger and BTB domain containing 24,-0.601712231096285,8.39201199523217,-1.51751652952146,0.0019001649972681,0.0211001838432907,0,8.05905103208207,8.03299855272509,8.19375448256733,8.16770200321035,8.72469121405135,8.75074369340833,8.61604024292307,8.58998776356609,"GO:0002244 hematopoietic progenitor cell differentiation; GO:0006351 transcription, DNA-templated; GO:0006355 regulation of transcription, DNA-templated",GO:0005634 nucleus,GO:0003677 DNA binding; GO:0005515 protein binding; GO:0046872 metal ion binding,,NM_014797,ZBTB24,0.601712231096285
1101,ZNF350,A_23_P78458,1,59348.0,zinc finger protein 350,0.6320074,8.339278,1.54972,0.001920328,0.02129483,0,8.732966,8.801357,8.541239,8.60963,7.941939,7.873548,8.065276,8.133667,"GO:0000122 negative regulation of transcription from RNA polymerase II promoter; GO:0006351 transcription, DNA-templated; GO:0006355 regulation of transcription, DNA-templated; GO:0045892 negative regulation of transcription, DNA-templated; GO:0045944 positive regulation of transcription from RNA polymerase II promoter",GO:0005634 nucleus; GO:0005654 nucleoplasm; GO:0016363 nuclear matrix; GO:0017053 transcriptional repressor complex,"GO:0001162 RNA polymerase II intronic transcription regulatory region sequence-specific DNA binding; GO:0001227 transcriptional repressor activity, RNA polymerase II transcription regulatory region sequence-specific binding; GO:0003677 DNA binding; GO:0046872 metal ion binding",,NM_021632,ZNF350,0.6320074
1493,ZFP62,A_23_P69877,1,643836.0,ZFP62 zinc finger protein,-0.5444335,10.60634,-1.458448,0.002052266,0.02261829,-1,10.34604,10.34031,10.33153,10.3258,10.8725,10.87823,10.89274,10.88701,"GO:0006351 transcription, DNA-templated; GO:0006355 regulation of transcription, DNA-templated",GO:0005634 nucleus,GO:0003676 nucleic acid binding; GO:0046872 metal ion binding,,NM_152283,ZFP62,0.5444335
1412,ZNF395,A_23_P146077,1,55893.0,zinc finger protein 395,-0.5597431,9.062498,-1.474007,0.002078198,0.02287292,0,8.82924,8.79767,8.821783,8.790213,9.312669,9.344239,9.351696,9.320126,"GO:0006351 transcription, DNA-templated; GO:0006355 regulation of transcription, DNA-templated; GO:0006357 regulation of transcription from RNA polymerase II promoter",GO:0005634 nucleus; GO:0005737 cytoplasm,GO:0000978 RNA polymerase II core promoter proximal region sequence-specific DNA binding; GO:0000978 RNA polymerase II core promoter proximal region sequence-specific DNA binding; GO:0001158 enhancer sequence-specific DNA binding; GO:0003677 DNA binding; GO:0046872 metal ion binding,,NM_018660,ZNF395,0.5597431
